[
  {
    "id": "pravda-hungary",
    "name": "Pravda Magyarország (Hungarian Portal Kombat mirror)",
    "aliases": [
      "pravda-hu.com",
      "hungary.news-pravda.com",
      "Portal Kombat"
    ],
    "category": "infrastructure",
    "attribution": {
      "actor": "Pravda network / Portal Kombat (built by Crimea-based TigerWeb, Yevgeny Shevchenko)",
      "sponsor": "Russia",
      "confidence": "high",
      "attributed_by": [
        "VIGINUM",
        "DFRLab",
        "CheckFirst",
        "EDMO",
        "American Sunlight Project"
      ]
    },
    "target": {
      "countries": [
        "Hungary"
      ],
      "audience": "search engines, AI crawlers, and Hungarian-language readers"
    },
    "period": {
      "start": "2024-03-20",
      "end": "ongoing"
    },
    "ai_usage": [
      "automated mass republication at machine scale",
      "assessed LLM grooming (flooding AI training/retrieval data)"
    ],
    "platforms": [
      "web",
      "Telegram",
      "VK"
    ],
    "scale": {
      "articles_total": "139,376 through 2026-08-10 (data_refs)",
      "daily_rate_last30": "~185 articles/day (data_refs)",
      "peak_day": "712 articles on 2024-07-05 (data_refs)",
      "network_total": "estimated >3.6M articles/year across the network (American Sunlight Project projection from a 48-hour sample, Feb 2025; NewsGuard renders this as '3.6 million articles in 2024')"
    },
    "effectiveness": "EDMO judged the Pravda sites' human audience impact across targeted EU countries 'very small... in some countries almost non-existent' (Apr 2024; no Hungary-specific assessment was published); the assessed aim is contaminating AI systems, where NewsGuard found leading chatbots repeating Pravda-network falsehoods ~33% of the time (Mar 2025).",
    "disarm_techniques": [
      "T0098.001",
      "T0049.007",
      "T0084",
      "T0019",
      "T0119.002"
    ],
    "data_refs": [
      "data/derived/pravda_summary.json",
      "data/derived/pravda_network.json"
    ],
    "summary": "The Hungarian mirror of the Pravda/Portal Kombat network was created on 20 March 2024 in a 31-domain wave extending the network to 19 EU states (Russian-hosted IP 178.21.15[.]85, paired Telegram/VK channels). It republishes fringe pro-Kremlin Hungarian Telegram channels and Russian state media as machine-generated 'news' around the clock, and remains active. Its top feeder sources are Hungarian-language Telegram channels led by 'the Russians' truth side' (oroszokazigazsagoldalan), greatawakeningmagyarok and ebredes2017; the GRU-linked Rybar_HU also feeds it, ranked seventh.",
    "sources": [
      {
        "publisher": "VIGINUM/SGDSN",
        "title": "Portal Kombat network report part 3 (Annex 1: domain list)",
        "date": "2024-04-28",
        "url": "https://www.sgdsn.gouv.fr/files/files/Publications/20240428_NP_SGDSN_VIGINUM_PORTAL-KOMBAT-NETWORK-REPORT_NEW%20DOMAIN%20NAME_(PART3)_ENG_VF.pdf"
      },
      {
        "publisher": "EDMO",
        "title": "Russian disinformation network Pravda grew bigger in the EU",
        "date": "2024-04-24",
        "url": "https://edmo.eu/publications/russian-disinformation-network-pravda-grew-bigger-in-the-eu-even-after-its-uncovering/"
      },
      {
        "publisher": "American Sunlight Project",
        "title": "A Pro-Russia Content Network Foreshadows the Automated Future of Info Ops (LLM grooming report)",
        "date": "2025-02-26",
        "url": "https://static1.squarespace.com/static/6612cbdfd9a9ce56ef931004/t/67fd396818196f3d1666bc23/1744648558879/PK+Report.pdf"
      },
      {
        "publisher": "NewsGuard",
        "title": "Moscow-based global news network infected Western AI",
        "date": "2025-03-06",
        "url": "https://www.newsguardtech.com/special-reports/moscow-based-global-news-network-infected-western-artificial-intelligence-russian-propaganda/"
      },
      {
        "publisher": "CheckFirst",
        "title": "Pravda Network Data Collection (hourly dataset)",
        "url": "https://github.com/CheckFirstHQ/pravda-network"
      },
      {
        "publisher": "DFRLab",
        "title": "Pravda in the pipeline (training-data contamination)",
        "date": "2026-04-08",
        "url": "https://dfrlab.org/2026/04/08/pravda-in-the-pipeline/"
      }
    ],
    "caveats": "Per-country audience measurement is thin; article volume is machine-verified but reach claims must rely on EDMO/NewsGuard assessments. Network size figures diverge across researchers (150–224+ domains).",
    "status": "verified"
  },
  {
    "id": "storm-1516-hungary-2026",
    "name": "Storm-1516 fake-outlet campaign against the Hungarian opposition",
    "aliases": [
      "CopyCop (Recorded Future)",
      "hirekhub24.hu",
      "oknyomozoriport.hu",
      "napihirek24.hu",
      "euronews.us.com",
      "24veritas.com"
    ],
    "category": "operation",
    "attribution": {
      "actor": "Storm-1516 / CopyCop",
      "sponsor": "Russia (GRU-linked Center for Geopolitical Expertise; John Mark Dougan)",
      "confidence": "high",
      "attributed_by": [
        "Clemson Media Forensics Hub",
        "Gnida Project",
        "EDMO/Lakmusz",
        "Euronews",
        "The Insider"
      ]
    },
    "target": {
      "countries": [
        "Hungary"
      ],
      "event": "2026-04-12 parliamentary election",
      "audience": "Hungarian voters; documented Facebook ad audiences skewed 65+ (The Insider)"
    },
    "period": {
      "start": "2026-01",
      "end": "2026-04"
    },
    "ai_usage": [
      "LLM-rewritten fake news articles (CopyCop method)",
      "fabricated videos",
      "fake journalist personas"
    ],
    "platforms": [
      "fake news websites",
      "Facebook ads",
      "X",
      "YouTube"
    ],
    "scale": {
      "fake_sites": "at least six new sites registered within two weeks (Euronews); of five analyzed, four shared the same paid WordPress theme (Soledad) and hosting IP, three of them registered within a single week (The Insider)",
      "ivanyi_smear_reach": "at least 90,000 and, per The Insider, over 120,000 users — mostly 65+ — via two Facebook ads run 20–24 Feb 2026 (Lakmusz: ~90,000 + ~35,000 with unknown overlap; EDMO: 'nearly 100,000'; The Insider: 'exceeded 120,000 people — mostly in the over-65 age group')",
      "ruszin_szendi_smear_reach": "at least 100,000 users in one week via paid Facebook ads (Euronews, 13 Apr 2026; Lakmusz via Gnida Project)"
    },
    "effectiveness": "Engagement was limited and often negative — most fake-site articles saw low engagement and mostly negative responses (Gnida Project); the fabrications were 'so far-fetched that not even the pro-government media picked them up' (TechPolicy.press); Tisza won the election. Post-election Repsense data showing counter-narratives frequently outpacing disinformation (Balkan Insight) covered the domestic pro-government campaign, not Storm-1516 specifically — Repsense noted Russian coordination 'cannot be established from content data alone'.",
    "disarm_techniques": [
      "T0098.001",
      "T0085.003",
      "T0085.001",
      "T0087",
      "T0097",
      "T0099.002",
      "T0018",
      "T0135.001"
    ],
    "summary": "In the weeks before Hungary's April 2026 election, Storm-1516 registered a cluster of fake Hungarian news sites — several on a shared hosting IP, four of five using the same paid WordPress theme (The Insider) — plus a spoof of Euronews (euronews.us.com), spreading fabrications against Péter Magyar and other Tisza figures: a staged Trump insult, a claim that Magyar funnelled €40M, an Epstein smear of Tisza vice-president Ágnes Forsthoffer, and a false claim that ex-defence-chief Romulusz Ruszin-Szendi recruited Hungarians to fight in Ukraine — alongside a fabricated pedophilia accusation against pastor Gábor Iványi, amplified through paid Facebook ads whose audiences skewed heavily 65+.",
    "sources": [
      {
        "publisher": "Clemson Media Forensics Hub",
        "title": "Hungary for more? (Murray, Linvill, Warren)",
        "date": "2026-04-10",
        "url": "https://open.clemson.edu/mfh_reports/11/"
      },
      {
        "publisher": "Gnida Project",
        "title": "Disinformation update: election in Hungary, Rostec, Rybar and a fake Armenian priest",
        "date": "2026-03-31",
        "url": "https://gnidaproject.substack.com/p/disinformation-update-mar-2026"
      },
      {
        "publisher": "Euronews",
        "title": "Impersonating Euronews: pro-Kremlin network takes aim at Hungary's elections",
        "date": "2026-03-24",
        "url": "https://euronews.com/my-europe/2026/03/24/impersonating-euronews-pro-kremlin-disinformation-network-takes-aim-at-hungarys-elections"
      },
      {
        "publisher": "EDMO",
        "title": "Russian disinformation campaigns against Hungarian opposition figures",
        "date": "2026-03-02",
        "url": "https://edmo.eu/publications/russian-disinformation-campaigns-against-hungarian-opposition-figures-457-political-ads-in-6-weeks-and-ai-generated-videos-once-again/"
      },
      {
        "publisher": "Recorded Future",
        "title": "CopyCop deepens its playbook (attribution/infrastructure background)",
        "url": "https://www.recordedfuture.com/research/copycop-deepens-its-playbook-with-new-websites-and-targets"
      },
      {
        "publisher": "The Insider",
        "title": "'Matryoshka' enters the fray: The Kremlin and the GRU are spreading disinformation in Hungary ahead of its pivotal parliamentary election",
        "date": "2026-04-11",
        "url": "https://theins.press/en/inv/291361"
      },
      {
        "publisher": "Gnida Project",
        "title": "Storm-1516 sets aim at parliamentary election in Hungary",
        "date": "2026-02-23",
        "url": "https://gnidaproject.substack.com/p/storm-1516-sets-aim-at-parliamentary"
      },
      {
        "publisher": "Euronews",